VENDOR	CODE	BARCODE	BARCODE_DISPLAY	NAME_KR	NAME_EN	SIZE
Hanmi	15781	087703157811	0 87703 15781 1	요고베라,망고	SOFT DRINK WITH ALOE (YOGOVERA MANGO)	20/16.89FLOZ(500ML)
Hanmi	15778	087703157781	0 87703 15778 1	요고베라,망고	SOFT DRINK WITH ALOE (YOGOVERA MANGO)	12/50.67FLOZ(1.5L)
Hanmi	16492	087703164925	0 87703 16492 5	요고베라,코코넛	SOFT DRINK WITH ALOE (YOGOVERA COCONUT)	20/16.89FLOZ(500ML)
Hanmi	16491	087703164918	0 87703 16491 8	요고베라,코코넛	SOFT DRINK WITH ALOE (YOGOVERA COCONUT)	12/50.67FLOZ(1.5L)
Hanmi	15780	087703157804	0 87703 15780 4	요고베라,파인애플	SOFT DRINK WITH ALOE (YOGOVERA PINEAPPLE)	20/16.89FLOZ(500ML)
Hanmi	14781	087703147812	0 87703 14781 2	요고베라,파인애플	SOFT DRINK WITH ALOE (YOGOVERA PINEAPPLE)	12/50.7FLOZ(1.5L)
Hanmi	16713	087703167131	0 87703 16713 1	요고베라,딸기	SOFT DRINK WITH ALOE (YOGOVERA STRAWBERRY)	20/16.89FLOZ(500ML)
Hanmi	16680	087703166806	0 87703 16680 6	요고베라,딸기	SOFT DRINK WITH ALOE (YOGOVERA STRAWBERRY)	12/50.67FLOZ(1.5L)
Hanmi	15782	087703157828	0 87703 15782 8	요고베라,복숭아	SOFT DRINK WITH ALOE (YOGOVERA PEACH)	20/16.89FLOZ(500ML)
Hanmi	14780	087703147805	0 87703 14780 5	요고베라,복숭아	SOFT DRINK WITH ALOE (YOGOVERA PEACH)	12/50.67FLOZ(1.5L)
Hanmi	16681	087703166813	0 87703 16681 3	요고베라,메론	SOFT DRINK WITH ALOE (YOGOVERA MELON)	20/16.89FLOZ(500ML)
Hanmi	16682	087703166820	0 87703 16682 0	요고베라,메론	SOFT DRINK WITH ALOE (YOGOVERA MELON)	12/50.67FLOZ(1.5L)
Hanmi	34112	087703341128	0 87703 34112 8	요고베라,수박	SOFT DRINK WITH ALOE (YOGOVERA WATERMELON)	20/16.89FLOZ(500ML)
Hanmi	32534	087703325340	0 87703 32534 0	요고베라,수박	SOFT DRINK WITH ALOE (YOGOVERA WATERMELON)	12/50.67FLOZ(1.5L)
Hanmi	05430	087703054301	0 87703 05430 1	요고베라，패션후르츠	SOFT DRINK WITH ALOE (YOGOVERA PASSION FRUIT)	20/16.89FLOZ(500ML)
Hanmi	05260	087703052604	0 87703 05260 4	요고베라，패션후르츠	SOFT DRINK WITH ALOE (YOGOVERA PASSION FRUIT)	12/50.67FLOZ(1.5L)
Hanmi	08500	087703085008	0 87703 08500 8	왕요고베라구아바	WANG Yogovera Guava 500ml	20/500 ml
Hanmi	08499	087703084995	0 87703 08499 5	왕요고베라구아바	WANG Yogovera Guava	12/1.5L
Hanmi	13832	087703138322	0 87703 13832 2	알로에드림(왕)	ALOE DRINK, ALOE DREAM	20/16.89FLOZ(500ML)
Hanmi	13831	087703138315	0 87703 13831 5	알로에드림(왕)	ALOE DRINK, ALOE DREAM	12/50.67FLOZ(1.5L)
Hanmi	11348	087703113480	0 87703 11348 0	블랙보리누룽지	SCORCHED RICE DRINK	4/6/520ml
Hanmi	11347	087703113473	0 87703 11347 3	블랙보리다크로스트	DARK BARLEY ROASTED DRINK	4/6/520ml
Hanmi	19567	087703195677	0 87703 19567 7	구겐오미자스파클링	Schizandra Sparkling Tea	12/10.98FL
Hanmi	16269	087703162693	0 87703 16269 3	뽀로로사과	Pororo Apple Drink	24/235G
Hanmi	16270	087703162709	0 87703 16270 9	뽀로로딸기	Pororo Strawberry Drink	24/235G
Hanmi	16271	087703162716	0 87703 16271 6	뽀로로밀크	Pororo Original Milk Drink	24/235G
Hanmi	16880	087703168800	0 87703 16880 0	뽀로로블루베리	Pororo Blueberry Drink	24/235G
Hanmi	04214	087703042148	0 87703 04214 8	뽀로로샤인머스켓	Pororo Shine Muscat Flavor	24/235G
Hanmi	83349	087703833494	0 87703 83349 4	빙그레바닐라맛우유	BINGGRAE Vanilla Flavored Milk	4/6/6.8oz
Hanmi	15041	087703150416	0 87703 15041 6	빙그레바나나맛우유	BINGGRAE Banana Milk	4/6/6.8 floz (200ml)
Hanmi	18532	087703185326	0 87703 18532 6	빙그레딸기맛우유	BINGGRAE Strawberry Milk	4/6/6.8 floz (200ml)
Hanmi	20702	087703207028	0 87703 20702 8	빙그레메론맛우유	BINGGRAE Melon Milk	4/6/6.8 floz (200ml)
Hanmi	80876	087703808768	0 87703 80876 8	빙그레커피맛우유	BINGGRAE Coffee Milk	4/6/6.8 floz (200ml)
Hanmi	81555	087703815551	0 87703 81555 1	빙그레타로맛우유	BINGGRAE Taro Milk	4/6/6.8 floz (200ml)
Hanmi	03226	087703032262	0 87703 03226 2	카카오망고스무디	KAKAO Mango Smoothie	24/6.42OZ
Hanmi	03227	087703032279	0 87703 03227 9	카카오복숭아스무디	KAKAO Peach Smoothie	24/6.42OZ
Hanmi	03228	087703032286	0 87703 03228 6	카카오애플스무디	KAKAO Apple Smoothie	24/6.42OZ
Hanmi	06291	087703062917	0 87703 06291 7	카카오딸기스무디	Kakao Strawberry Smoothie	24/6.42OZ
Hanmi	36350	087703363502	0 87703 36350 2	구겐코코넛밀크,오리지널	COCONUT MILK W/NATA DE COCO (ORIGINAL)	24/9.80FLOZ(290ML)
Hanmi	36352	087703363526	0 87703 36352 6	구겐코코넛밀크,바나나	COCONUT MILK W/NATA DE COCO (BANANA)	24/9.80FLOZ(290ML)
Hanmi	36353	087703363533	0 87703 36353 3	구겐코코넛밀크,망고	COCONUT MILK W/NATA DE COCO (MANGO)	24/9.80FLOZ(290ML)
Hanmi	36354	087703363540	0 87703 36354 0	구겐코코넛밀크,파인애플	COCONUT MILK W/NATA DE COCO (PINEAPPLE)	24/9.80FLOZ(290ML)
Hanmi	36355	087703363557	0 87703 36355 7	구겐코코넛밀크,딸기	COCONUT MILK W/NATA DE COCO (STRAWBERRY)	24/9.80FLOZ(290ML)
Hanmi	36356	087703363564	0 87703 36356 4	구겐코코넛밀크,메론	COCONUT MILK W/NATA DE COCO (MELON)	24/9.80FLOZ(290ML)
Hanmi	09768	087703097681	0 87703 09768 1	코코넛주스드링크(구겐	GUGEN Coconut Juice Drink With Pulp	4/6/9.80oz
Hanmi	23060	087703230606	0 87703 23060 6	바질시드드링크망고맛	BASILSEED DRINK MANGO	24/9.8oz
Hanmi	23061	087703230613	0 87703 23061 3	바질시드드링크리치맛	BASILSEED DRINK LYCHEE	24/9.8oz
Hanmi	23063	087703230637	0 87703 23063 7	바질시드드링크파인애플맛	BASILSEED DRINK PINEAPPLE	24/9.8oz
Hanmi	23064	087703230644	0 87703 23064 4	바질시드드링크패션후르츠맛	BASILSEED DRINK PASSIONFRUIT	24/9.8oz
Hanmi	05674	087703056749	0 87703 05674 9	동화쌍화탕	DONGWHA Carbonated Herb Tonic Drink	5/10/100ml
Hanmi	11847	087703118478	0 87703 11847 8	동화미인활액	DONGHWA Carbonated Soft Digestion Drink	6/10/75ml
Hanmi	19558	087703195585	0 87703 19558 5	부채표가을생강쌍화탕	DONGWHA Carbonated Herb Ginger Drink	5/10/100ml
Hanmi	11870	087703118706	0 87703 11870 6	부채표쌍화골드도라지	DONGHWA 9 Herbs Bellflower Root Drink	10/10/100 ml
Hanmi	11872	087703118720	0 87703 11872 0	동화생생톤UP	DONGHWA Soft Energy Drink	5/10/120ml
Hanmi	11881	087703118812	0 87703 11881 2	동화비타천플러스	DONGHWA Soft Vitamin Drink	5/10/120ml
Hanmi	15053	087703150539	0 87703 15053 9	동화까스활명수	Carbonated Herbs Drink	6/10/75ML
Hanmi	8500591			동아박카스-D (수출용)	Bacchus-D ENERGY DRINK	5/10/3.3FLOZ(100ML)
Hanmi	8500593			동아)박카스X	Bacchus-X ENERGY DRINK	10/10/100ml
Hanmi	10738	087703107380	0 87703 10738 0	까망두유(왕)	BLACK SESAME & BLACK SOY MILK	24/6.42FLOZ(190ML)
Hanmi	14081	087703140813	0 87703 14081 3	쌍화탕,원방(광동)	Soft Herb Drink	10/10/3.38FLOZ(100ML)
Hanmi	12747	087703127470	0 87703 12747 0	속청(종근당)	Carbonated Herbs Drink	6/10/2.5FL OZ (750ML)
Hanmi	10161	087703101616	0 87703 10161 6	인삼드링크(수라상)	GINSENG DRINK W/ROOT	5/10/4.05FLOZ(120ML)
Hanmi	32265	087703322653	0 87703 32265 3	홍삼드링크(수라상)	RED GINSENG DRINK W/ROOT	5/10/4.05FLOZ(120ML)
Hanmi	08300	087703083004	0 87703 08300 4	포카리스웨트(동아)	SPORT AND ENERGY DRINK	5/6/8.28FLOZ(245ML)
Hanmi	08750	087703087507	0 87703 08750 7	포카리스웨트(동아)	SPORT AND ENERGY DRINK	12/50.67FLOZ(1.5L)
Hanmi	06881	087703068810	0 87703 06881 0	동아포카리스웨트	Pocari Sweat Drink 500ml	20/500ml
Hanmi	81701	087703817012	0 87703 81701 2	해태갈아만든배	HAITAI Crusshed Pear Juice(PET)	12/1.5LT
Hanmi	82362	087703823624	0 87703 82362 4	해태갈아만든배	HAITAI Crusshed Pear Juice	24/500 ml
Hanmi	81822	087703818224	0 87703 81822 4	해태갈배사이다	HAITAI Pear-Cider 1.5LT	12/1.5LT
Hanmi	81821	087703818217	0 87703 81821 7	해태갈배사이다	HAITAI Pear-Cider 500ml	24/500 ml
Hanmi	33250	087703332508	0 87703 33250 8	블랙보리드링크	Roaster Dark Barley Tea 1.5L	12/1.5 L
Hanmi	33251	087703332515	0 87703 33251 5	블랙보리드링크	Roaster Dark Barley Tea 520ML	4/6/520ml
Hanmi	07623	087703076235	0 87703 07623 5	아침햇살(웅진)	RICE MILK DRINK	12/50.67FLOZ(1.5L)
Hanmi	07624	087703076242	0 87703 07624 2	아침햇살(웅진)	RICE MILK DRINK	20/16.9FLOZ(500ML)
Hanmi	81849	087703818491	0 87703 81849 1	롯데D밀키스LOW CALORIE	LOTTE Milkis CAN Low Calorie	5/6/250G
Hanmi	80786	087703807860	0 87703 80786 0	밀키스ORG (LOTTE)	CARBONATED SOFT DRINK ORIGINAL FLAVOR	5/6/8.45FLOZ(250ML)
Hanmi	80787	087703807877	0 87703 80787 7	밀키스딸기	CARBONATED SOFT DRINK STRAWBERRY FLAVOR	5/6/8.45FLOZ(250ML)
Hanmi	80788	087703807884	0 87703 80788 4	밀키스메론	CARBONATED SOFT DRINK MELON FLAVOR	5/6/8.45FLOZ(250ML)
Hanmi	80790	087703807907	0 87703 80790 7	밀키스봉숭아	CARBONATED SOFT DRINK PEACH FLAVOR	5/6/8.45FLOZ(250ML)
Hanmi	80791	087703807914	0 87703 80791 4	밀키스바나나	CARBONATED SOFT DRINK BANANA FLAVOR	5/6/8.45FLOZ(250ML)
Hanmi	82488	087703824881	0 87703 82488 1	롯데D밀키스포도맛	MILKIS GRAPE	5/6/250 ml
Hanmi	09402	087703094024	0 87703 09402 4	파이어진에너지음류	FIREGIN ENERGY DRINK	5/6/8.45OZ
Hanmi	08302	087703083028	0 87703 08302 8	데미소다,애플(동아)	CARBONATED SOFT DRINK APPLE FLAVOR	5/6/8.44FLOZ(250ML)
Hanmi	20451	087703204515	0 87703 20451 5	데미소다,복숭아(동아)	CARBONATED SOFT DRINK PEACH FLAVOR	5/6/8.44FLOZ(250ML)
Hanmi	20458	087703204584	0 87703 20458 4	데미소다,레몬(동아)	CARBONATED SOFT DRINK LEMON FLAVOR	5/6/8.44FLOZ(250ML)
Hanmi	82499	087703824997	0 87703 82499 7	데미소다,청포도	DONG-A Demisoda,Green Grape	5/6/8.45FL
Hanmi	11699	087703116993	0 87703 11699 3	천연사이다(일화)	CARBONATED CIDER DRINK	30/8.45FLOZ(250ML)
Hanmi	11700	087703117006	0 87703 11700 6	맥콜(일화)	CARBONATED SOFT DRINK BARLEY FLAVOR	30/8.44FLOZ(250ML)
Hanmi	19499	087703194991	0 87703 19499 1	동아오란씨오렌지	CARBONATED SOFT DRINK ORAGNE FLAVOR	30/8.44FLOZ(250ML)
Hanmi	19500	087703195004	0 87703 19500 4	동아오란씨파인	CARBONATED SOFT DRINK PINEAPPLE FLAVOR	5/6/250ml
Hanmi	33909	087703339095	0 87703 33909 5	유어스한라봉스파클링	YouUs Mandarin Sparkling Drink	4/6/12OZ
Hanmi	81824	087703818248	0 87703 81824 8	해태복숭아봉봉	HAITAI Bongbong-Peach	4/6/340ml
Hanmi	12471	087703124714	0 87703 12471 4	식혜(하늘청)	SWEET RICE PUNCH	8/1.8 LT
Hanmi	12472	087703124721	0 87703 12472 1	수정과(하늘청)	SWEET CINNAMON PUNCH	8/1.8 LT
Hanmi	12503	087703125032	0 87703 12503 2	하늘청수정과	Korean Traditional Cinnamon Punch	4/6/11.83floz
Hanmi	12476	087703124769	0 87703 12476 9	하늘청감주	Korean Traditional Rice Punch	4/6/11.83floz
Hanmi	82485	087703824850	0 87703 82485 0	해태큰집식혜	HAITAI Korean Rice Punch	6/12/238ml
Hanmi	00587	087703005877	0 87703 00587 7	포도봉봉(HAITAI)	SOFT DRINK WITH GRAPE	6/12/8.04FLOZ(238ML)
Hanmi	06062	087703060623	0 87703 06062 3	갈아만든배(HAITAI)	SOFT DRINK WITH PEAR	6/12/8.04FLOZ(238ML)
Hanmi	05486	087703054868	0 87703 05486 8	코코팜,포도(HAITAI)	SOFT DRINK WITH NATA DE COCO	6/12/8.04FLOZ(238ML)
Hanmi	09324	087703093249	0 87703 09324 9	왕알로에포도송송	WANG White Grape and Aloe Vera Juice	6/12/8.04OZ
Hanmi	81339	087703813397	0 87703 81339 7	테스틀리곤약복숭아	Tastelli Konjac Jelly Drink Peach	4/10/5.07OZ
Hanmi	81340	087703813403	0 87703 81340 3	테스틀리곤약맹고파인	Tastelli Konjac Jelly Drink Mango/Pine	4/10/5.07OZ
Hanmi	81341	087703813410	0 87703 81341 0	테스틀리곤약청포도사과	Tastelli Konjac Jelly Drink Apple Grape	4/10/5.07OZ
Hanmi	81342	087703813427	0 87703 81342 7	테스틀리곤약더블베리	Tastelli Konjac Jelly Drink Double Berry	4/10/5.07OZ
Hanmi	82730	087703827301	0 87703 82730 1	테스틀리곤약리치	Tastelli Lychee Konjac Jelly	4/10/5.07oz
Hanmi	82425	087703824256	0 87703 82425 6	Tastelli Kids사과곤약젤리	Tastelli Kids Apple Fruity Gel	6/4/3.53oz
Hanmi	82426	087703824263	0 87703 82426 3	Tastelli Kids망고곤약젤리	Tastelli Kids Mango Fruity Gel	6/4/3.53oz
Hanmi	82667	087703826670	0 87703 82667 0	BT21곤약젤리리치	EVERYDAZE LYCHEE Essential Konjac Jelly	4/10/150ml
Hanmi	82668	087703826687	0 87703 82668 7	BT21곤약젤리봉숭아	EVERYDAZE PEACH Essential Konjac Jelly	4/10/150ml
Hanmi	82669	087703826694	0 87703 82669 4	BT21곤약젤리망고	EVERYDAZE MANGO Essential Konjac Jelly	4/10/150ml
Hanmi	82670	087703826700	0 87703 82670 0	BT21곤약젤리포도	EVERYDAZE GRAPE Essential Konjac Jelly	4/10/150ml
Hanmi	82671	087703826717	0 87703 82671 7	BT21곤약젤리배	EVERYDAZE PEAR Essential Konjac Jelly	4/10/150ml
Hanmi	82672	087703826724	0 87703 82672 4	BT21곤약젤리수박	EVERYDAZE WATERMELON Essential Konjac Jelly	4/10/150ml
Hanmi	82673	087703826731	0 87703 82673 1	BT21곤약젤리요거트	EVERYDAZE YOGURT Essential Konjac Jelly	4/10/150ml
Hanmi	08777	087703087774	0 87703 08777 4	슈가로로곤약젤리복숭아	Sugarlolo Peach Konjac Jelly	4/10/5.29oz
Hanmi	08778	087703087781	0 87703 08778 1	슈가로로곤약젤리망고	Sugarlolo Mango Konjac Jelly	4/10/5.29oz
Hanmi	08779	087703087798	0 87703 08779 8	슈가로로곤약젤리리치	Sugarlolo Lychee Konjac Jelly	4/10/5.29oz
Hanmi	08781	087703087811	0 87703 08781 1	슈가로로곤약젤리석류	Sugarlolo Pomegranate Konjac Jelly	4/10/5.29oz
Hanmi	08788	087703087880	0 87703 08788 0	슈가로로곤약젤리딸기&키위	Sugarlolo Straw/Kiwi Konjac Jelly	4/10/5.29oz
Hanmi	09580	087703095809	0 87703 09580 9	슈가로로곤약젤리망고스틴	Sugarlolo Mangosteen Konjac Jelly	4/10/5.29oz
Hanmi	22596	087703225961	0 87703 22596 1	왕요고베라에이드메론	WANG Yogovera Melon Ade	5/10/7.7oz
Hanmi	22597	087703225978	0 87703 22597 8	왕요고베라에이드딸기	WANG Yogovera Strawberry Ade	5/10/7.7oz
Hanmi	22598	087703225985	0 87703 22598 5	왕요고베라에이드망고	WANG Yogovera Mango Ade	5/10/7.7oz
Hanmi	83521	087703835214	0 87703 83521 4	동원보성녹차	DONGWON Green Tea	24/350 ml
Hanmi	83522	087703835221	0 87703 83522 1	동원녹차	DONGWON Green Tea	12/1.5 LT
Hanmi	83523	087703835238	0 87703 83523 8	동원양반배식혜	DONGWON Rice Drink Pear	12/1.5 LT
Hanmi	83524	087703835245	0 87703 83524 5	동원양반배식혜	DONWON Rice Drink,(Pear)	4/6/500 ml
Hanmi	83525	087703835252	0 87703 83525 2	동원양반배수정과	DONWON Cinnamon & Pear Punch	4/6/500 ml
Hanmi	82345	087703823457	0 87703 82345 7	롯데칸타타카라멜마끼아또	CANTATA CARAMEL MACCHIATO	4/6/275ml
Hanmi	82346	087703823464	0 87703 82346 4	롯데칸타타프리미엄	CANTATA PREMIUM LATTE	4/6/275ml
Hanmi	82347	087703823471	0 87703 82347 1	롯데칸타타콜드브루흑당	CANTATA COLD BROWN SUGAR	4/6/275ml
Hanmi	80797	087703807976	0 87703 80797 6	롯데D레츠비캔커피	LOTTE Let's Be	5/6/175 ml
Hanmi	80796	087703807969	0 87703 80796 9	롯데D 2%복숭아	LOTTE 2% Peach	5/6/240 ml
Hanmi	08787	087703087873	0 87703 08787 3	롯데칠성사이다	LOTTE Chilsung Cider	5/6/250 ml
Hanmi	83598	087703835986	0 87703 83598 6	칠성사이다	Chilsung Cider 500ml	20/500ml
Hanmi	83609	087703836099	0 87703 83609 9	롯데2%복숭아	Lotte 2% Peach	24/500ml
Hanmi	80792	087703807921	0 87703 80792 1	롯데D밀키스PET	LOTTE Milkis Bottle 500ml	20/500 ml
Hanmi	81182	087703811829	0 87703 81182 9	롯데D초가을우엉차	LOTTE Burdock Tea Drink 500ml	24/500 ml
Hanmi	31587	087703315877	0 87703 31587 7	롯데아침헛개차	LOTTE Raisin Tea	24/500ml
Hanmi	81191	087703811911	0 87703 81191 1	롯데D황금보리차	LOTTE Golden Barley Drink 500ml	24/500 ML
Hanmi	80795	087703807952	0 87703 80795 2	롯데D쌕쌕오렌지	LOTTE SacSac Orange	6/12/238 ml
Hanmi	00224	087703002241	0 87703 00224 1	롯데쌕쌕포도	LOTTE Saacsac Grape	12/6/238 ml
Hanmi	83355	087703833555	0 87703 83355 5	EVERYDAZE곰부차,복숭아	EVERYDAZE Kombucha,Peach	4/10/5.07oz
Hanmi	83356	087703833562	0 87703 83356 2	EVERYDAZE곰부차,청포도	EVERYDAZE Kombucha,Green Grape	4/10/5.07oz
Hanmi	83357	087703833579	0 87703 83357 9	EVERYDAZE곰부차,파인애플패션프	EVERYDAZE Kombucha,Passionfruit	4/10/5.07oz
Hanmi	83358	087703833586	0 87703 83358 6	EVERTDAZE곰부차,레몬생강	EVERYDAZE Kombucha Lemonginger	4/10/5.07oz
Hanmi	83359	087703833593	0 87703 83359 3	EVERYDAZE곰부차,딸기키위	EVERYDAZE Kombucha,S/berryKiwi	4/10/5.07oz
Hanmi	83360	087703833609	0 87703 83360 9	EVERYDAZE곰부차,자몽블랙티	EVERYDAZE Kombucha,Grapefruit	4/10/5.07oz
Hanmi	83591	087703835917	0 87703 83591 7	콜라겐젤리스틱,복숭아	Collagen Jelly Stick Peach	30/10/0.7oz
Hanmi	83592	087703835924	0 87703 83592 4	콜라겐젤리스틱망고	Collagen Jelly Stick Mango	30/10/0.7oz
Hanmi	83593	087703835931	0 87703 83593 1	콜라겐젤리스틱청포도	Collagen Jelly Stick Green Grape	30/10/0.7oz
Hanmi	83594	087703835948	0 87703 83594 8	콜라겐젤리스틱석류	Collagen Jelly Stick Pomegranate	30/10/0.7oz
Hanmi	83588	087703835887	0 87703 83588 7	스위트젤리C곤약딸기	SWEET JELLY Vitamin C Strawberry	4/10/5.07oz
Hanmi	83589	087703835894	0 87703 83589 4	스위트젤리C곤약파인애플	SWEET JELLY Vitamin C Pineapple	4/10/5.07oz
Hanmi	83590	087703835900	0 87703 83590 0	스위트젤리C곤약포도	SWEET JELLY Vitamin C Grape	4/10/5.07oz
Hanmi	82099	087703820999	0 87703 82099 9	정관장활기력(병)	Korea Red Ginseng Vital Tonic	12/10 Bt/20 ml
Hanmi	82100	087703821002	0 87703 82100 2	정관장홍삼에브리타임자몽	K.Red Ginseng Everytime Grapefruit	12/10 Sticks/10 ml
Hanmi	82101	087703821019	0 87703 82101 9	정관장홍삼정캡슐플러스	Korean Red Ginseng Capsule Plus	36/30 Caps/600 mg
Hanmi	82816	087703828162	0 87703 82816 2	정관장홍삼에브리타임레몬	K.Red Ginseng Everytime Lemon Stick	12/10 Sticks/10 ml
Hanmi	08429	087703084292	0 87703 08429 2	홍삼원	RED GINSENG DRINK	10/10/3.3FLOZ(100ML)
Hanmi	21624	087703216242	0 87703 21624 2	수라상인삼차100포	Korean Ginseng Tea in Wooden Box	30/100/3G
Hanmi	82815	087703828155	0 87703 82815 5	정관장홍삼석류Pouch	K.Red Ginseng Organic Pomegranate Pouch	6/20Pouches/50ml
Hanmi	82357	087703823570	0 87703 82357 0	정관장고려삼차	K.Red Ginseng Korea Ginseng Tea	10/60 Sticks/0.11oz
Hanmi	82358	087703823587	0 87703 82358 7	정관장POWDER PURE100	K.Red Ginseng Powder 100	30/28 Sticks/1.5G
Hanmi	82489	087703824898	0 87703 82489 8	정관장홍삼진고데일리스틱	GINSENG HONEY DAILY STICK	16/30 Sticks/0.35oz
Hanmi	82490	087703824904	0 87703 82490 4	정관장고려삼차	KOREAN GINSENG TEA	2/8/25 Sticks
Hanmi	00560	087703005600	0 87703 00560 0	김치통조림(왕)	NAPA CABBAGE KIMCHI	48/5.64OZ(160G)
Hanmi	21988	087703219885	0 87703 21988 5	볶음김치통조림(왕)	CANNED STIR-FRIED KIMCHI	12/5.64OZ(160G)
Hanmi	34428	087703344280	0 87703 34428 0	왕갓김치통조림	Mustard Leaf Kimchi	48/5.64oz
Hanmi	27232	087703272323	0 87703 27232 3	살균병김치(무첨가)	NAPA CABBAGE KIMCHI	12/7.58OZ(215G)
Hanmi	16477	087703164772	0 87703 16477 2	팥통조림(수라상)	CANNED BOILED RED BEANS	24/16.58OZ(470G)
Hanmi	02327	087703023277	0 87703 02327 7	꽁치통조림(펭귄)	CANNED PACIFIC SAURY	24/14OZ(400G)
Hanmi	04193	087703041936	0 87703 04193 6	유동골뱅이통조림	YOODONG Bai-Top Shell (Canned Whelk)	24/14oz (400G)
Hanmi	83255	087703832558	0 87703 83255 8	동원자연산골뱅이	DW Canned Whelk	24/400g
Hanmi	83246	087703832466	0 87703 83246 6	라이트스탠다드참치번들	DW Canned Tuna Chunk Style 4pk	12/150g*4
Hanmi	83247	087703832473	0 87703 83247 3	라이트스탠다드참치번들	DW Canned Tuna Chunk Style 3pk	12/250g*3
Hanmi	83248	087703832480	0 87703 83248 0	고추참치번들	DW Canned Tuna Hot Pepper 4pk	12/150g*4
Hanmi	83249	087703832497	0 87703 83249 7	동원김치찌개용참치러브	DW Canned Tuna Kimchi Soup 4pk	12/150g*4
Hanmi	83250	087703832503	0 87703 83250 3	동원매운고추참치	DW Canned Tuna D/ble Hot Pepper 4pk	12/135g*4
Hanmi	83251	087703832510	0 87703 83251 0	동원맛참고소참기름	DW Tuna Chunk Syle in Sesame Oil 4pk	20/90g*4
Hanmi	83252	087703832527	0 87703 83252 7	동원맛참매콤참기름	DW Tuna Chunk Syle in Oil Spicy 4pk	20/90g*4
Hanmi	83253	087703832534	0 87703 83253 4	동원맛참고소참기름	DW Tuna Chunk Syle in Sesame Oil 4pk	12/135g*4
Hanmi	83254	087703832541	0 87703 83254 1	동원맛참매콤참기름	DW Tuna Chunk Syle in Oil Spicy 4pk	12/135g*4
Hanmi	83501	087703835016	0 87703 83501 6	동원참치BTS진에디션	DW Canned Tuna(BTS Edition)	12/4/150g
Hanmi	83547	087703835474	0 87703 83547 4	동원김치찌개용참치150G원터치	DW Canned Tuna One Touch	48/150g
Hanmi	83548	087703835481	0 87703 83548 1	동원고추참치150G원터치	DW Canned Tuna Hot Pepper 1Touch	48/150g
Hanmi	83502	087703835023	0 87703 83502 3	동원자연산꽁치400g원터치	DW Canned Boiled Pacific Saury	24/400g
Hanmi	83503	087703835030	0 87703 83503 0	동원고등어400g원터치	DW Canned Boiled Mackerel	24/400g
Hanmi	83504	087703835047	0 87703 83504 7	동원양반단호박죽	DW Rice Porridge Cup ,Pumpkin	24/ 285 g
Hanmi	83505	087703835054	0 87703 83505 4	동원양반밤단팥죽	DW Rice Porridge Cup ,Redbean	24/285 g
Hanmi	83256	087703832565	0 87703 83256 5	둥원전복죽	DW Rice Porridge Cup Abalone	24/287.5g
Hanmi	83506	087703835061	0 87703 83506 1	동원양반백합미역국	DW Retorted Venus Clam Seaweed	20/460 g
Hanmi	83507	087703835078	0 87703 83507 8	동원양반백합우거지된장	DW Soybean Pt. Soup w/Venus Clam	20/460g
Hanmi	83544	087703835443	0 87703 83544 3	동원양반나주식곰탕	DONGWON Beef Stock Soup	20/460g
Hanmi	83545	087703835450	0 87703 83545 0	동원수라보양추어탕	DW Vegetable&Loach Soup	20/460 g
Hanmi	16306	087703163065	0 87703 16306 5	꿀유자차(수라상)	CITRON TEA WITH HONEY	12/2.2LB(1KG)
Hanmi	01422	087703014220	0 87703 01422 0	꿀생강모과차(수라상)	GINGER & CHINESE QUINCE TEA WITH HONEY IN BOTTLE	12/2.2LBS(1KG)
Hanmi	17012	087703170124	0 87703 17012 4	꿀생강차(수라상)	GINGER TEA WITH HONEY	12/2.2LB(1KG)
Hanmi	17010	087703170100	0 87703 17010 0	꿀대추차(수라상)	JUJUBE TEA WITH HONEY	12/2.2LB(1KG)
Hanmi	01630	087703016309	0 87703 01630 9	꿀패션후르츠차(수라상)	PASSION FRUIT HONEY PUREE IN BOTTLE	12/2.2LBS(1KG)
Hanmi	00556	087703005563	0 87703 00556 3	다정인삼생강차	Ginseng Ginger Tea	15/580 g
Hanmi	16305	087703163058	0 87703 16305 8	꿀유자차(수라상)	CITRON TEA WITH HONEY	15/20.46OZ(580G)
Hanmi	18313	087703183131	0 87703 18313 1	꿀생강유자차(수라상)	CITRON TEA WITH HONEY GINGER	15/20.46OZ(580G)
Hanmi	04705	087703047051	0 87703 04705 1	꿀패션후르츠차(수라상)	PASSION FRUIT HONEY PUREE	12/1.21LB(550G)
Hanmi	01264	087703012646	0 87703 01264 6	배도라지차(수라상)	PEAR & PLATYCODON ROOT TEA IN BOTTLE	12/1.21LB(550G)
Hanmi	11903	087703119031	0 87703 11903 1	꿀패션후르츠망고차	HONEY PASSION FRUIT MANGO TEA	15/560g
Hanmi	10378	087703103788	0 87703 10378 8	현미녹차(수라상)티백	GREEN TEA WITH ROASTED BROWN RICE	15/150/0.04OZ(1.2G)
Hanmi	10800	087703108004	0 87703 10800 4	둥굴레차(수라상)티백	SOLOMON'S SEAL TEA	15/150/0.04OZ(1.2G)
Hanmi	17819	087703178199	0 87703 17819 9	메밀차(수라상)티백	BUCKWHEAT TEA	15/100/0.056OZ(1.6G)
Hanmi	10941	087703109414	0 87703 10941 4	녹차(수라상)티백	GREEN TEA	15/100/0.035OZ(1G)
Hanmi	24189	087703241893	0 87703 24189 3	우엉차(수라상)티백	BURDOCK TEA	30/100/0.105OZ(3G)
Hanmi	17224	087703172241	0 87703 17224 1	유기농녹차(수라상)티백	ORGANIC GREEN TEA	20/50/0.04OZ(1.2G)
Hanmi	17225	087703172258	0 87703 17225 8	유기농현미녹차(수라상)티백	ORGANIC GREEN TEA WITH BROWN RICE	30/50/0.04OZ(1.2G)
Hanmi	02265	087703022652	0 87703 02265 2	옥수수차(동서)주전자용	ROASTED CORN TEA	30/15/0.35OZ(10G)
Hanmi	14955	087703149557	0 87703 14955 7	녹차원유기농녹차가루	Organic Greentea powder	20/50G
Hanmi	00941	087703009417	0 87703 00941 7	보리차(수라상)	ROASTED BARLEY FOR BEVERAGE	12/2LB(907G)
Hanmi	00117	087703001176	0 87703 00117 6	보리차(수라상)	ROASTED BARLEY FOR BEVERAGE	5/4LB(1.8KG)
Hanmi	00945	087703009455	0 87703 00945 5	옥수수차(수라상)	ROASTED CORN FOR BEVERAGE	12/2LB(907G)
Hanmi	03968	087703039681	0 87703 03968 1	옥수수차(수라상)	ROASTED CORN FOR BEVERAGE	5/4LB(1.8KG)
Hanmi	17679	087703176799	0 87703 17679 9	메밀차(왕)통	ROASTED BUCKWHEAT TEA	12/10.58OZ(300G)
Hanmi	21410	087703214101	0 87703 21410 1	우엉차(왕)통	ROASTED BURDOCK FOR BEVERAGE	12/7.05OZ(200G)
Hanmi	03627	087703036277	0 87703 03627 7	결명자차(왕)통	ROASTED CASSIA SEED FOR BEVERAGE	12/22OZ(625G)
Hanmi	24566	087703245662	0 87703 24566 2	볶은율무차(왕)통	ROASTED ADLAY FOR BEVERAGE	12/7.4OZ(210G)
Hanmi	24567	087703245679	0 87703 24567 9	볶은현미차(왕)통	ROASTED BROWN RICE FOR BEVERAGE	12/7.4OZ(210G)
Hanmi	24568	087703245686	0 87703 24568 6	여주차(왕)통	BITTER GOURD FOR BEVERAGE	12/2.12OZ(60G)
Hanmi	08598	087703085985	0 87703 08598 5	구겐오트밀20곡미숫가루	GUGEN Oatmeal 20 Mixed Grain Powder	8/7oz.
Hanmi	08599	087703085992	0 87703 08599 2	구겐호두아몬드율무차	GUGEN Walnut Almond Powder	8/7oz.
Hanmi	16787	087703167872	0 87703 16787 2	마가들어간15곡미숫가루(담터)	KOREAN YAM TEA	8/40/0.7OZ(20G)
Hanmi	18583	087703185838	0 87703 18583 8	담터호두아몬드율무차	Powderde Cereal Mix in Pack	8/50T/0.6
Hanmi	34390	087703343900	0 87703 34390 0	검은콩,검은참깨,흑미미숫가루D010 4/14	Black Grain Mix Powder 40sticks	8/40ct/20g
Hanmi	34392	087703343924	0 87703 34392 4	슈퍼곡물12곡미숫가루D010 4/14	12 Super Grain Mix Powder 40sticks	8/40ct/20g
Hanmi	16198	087703161986	0 87703 16198 6	호두아몬드율무차(담터)	POWDERED CEREAL MIX	20/15/0.63OZ(18G)
Hanmi	16221	087703162211	0 87703 16221 1	담터생강차plus	Korean Ginger Tea	20/15T/0.52oz
Hanmi	16223	087703162235	0 87703 16223 5	담터쌍화차plus	Korean Herb Tea(SsangWhaCha)	20/15T/0.52oz
Hanmi	16219	087703162198	0 87703 16219 8	발아현미율무차(담터)	KOREAN BROWN RICE TEA	12/15/0.52OZ(15G)
Hanmi	19359	087703193598	0 87703 19359 8	고구마라떼D010 4/14	SWEET POTATO LATTE 12sticks	20/12ct/18g
